{
  "id": "basic-anti-acne-control",
  "slug": "basic-anti-acne-control",
  "categoryId": "dieu-tri-da",
  "title": "BASIC ANTI - ACNE CONTROL",
  "subtitle": "Giải Pháp Hoàn Hảo Cho Làn Da Mịn Màng Tại Her Skinlab",
  "price": "400,000 VNĐ",
  "duration": "60 phút",
  "hero": {
    "image": "assets/images/services/giam-dau-mun-lo-chan-long.jpg",
    "alt": "Basic Anti-Acne Control",
    "caption": "Basic Anti-Acne Control: Giải pháp giúp làm sạch sâu và se khít lỗ chân lông"
  },
  "toc": [
    {
      "id": "loi-ich",
      "label": "Lợi ích của Liệu Pháp Peel Chuyên Sâu",
      "children": [
        { "id": "y1", "label": "1. Điều Trị Mụn Thâm Hiệu Quả" },
        { "id": "y2", "label": "2. Mang Lại Làn Da Trắng Sáng" }
      ]
    },
    {
      "id": "quy-trinh",
      "label": "Quy Trình Liệu Pháp Peel Chuyên Sâu tại Her Skinlab",
      "children": [
        { "id": "b1", "label": "1. Tư Vấn và Khám Da" },
        { "id": "b2", "label": "2. Làm Sạch Da" },
        { "id": "b3", "label": "3. Áp Dụng dung dịch Peel" },
        { "id": "b4", "label": "4. Trung Hòa và Dưỡng Ẩm" }
      ]
    },
    { "id": "cham-soc", "label": "Chăm Sóc Sau Khi Peel" },
    { "id": "tai-sao-chon", "label": "Khách Hàng Nói Gì Về Liệu Pháp Peel tại Her Skinlab?" }
  ],
  "sections": [
    {
      "id": "gioi-thieu",
      "heading": "Basic Anti-Acne Control: Giải Pháp Hoàn Hảo Cho Làn Da Mịn Màng",
      "content": "Tại Her Skinlab, chúng tôi hiểu rằng mụn và lỗ chân lông to là những vấn đề phổ biến. Dịch vụ Basic Anti-Acne Control là giải pháp toàn diện giúp loại bỏ mụn, làm sạch sâu và se khít lỗ chân lông.",
      "image": "assets/images/services/giam-dau-mun-lo-chan-long.jpg"
    },
    {
      "id": "loi-ich",
      "heading": "Lợi Ích Của Dịch Vụ Basic Anti-Acne Control",
      "bullets": [
        "Loại bỏ mụn đầu đen, mụn trứng cá và các loại mụn khác",
        "Làm sạch lỗ chân lông, loại bỏ bụi bẩn và dầu thừa",
        "Se khít lỗ chân lông, giảm kích thước lỗ chân lông và làm mịn da"
      ]
    },
    {
      "id": "quy-trinh",
      "heading": "Quy Trình Dịch Vụ Basic Anti-Acne Control",
      "steps": [
        "Tư vấn tình trạng da và đề xuất phương pháp điều trị phù hợp",
        "Làm sạch da để loại bỏ bụi bẩn và dầu thừa",
        "Lấy mụn: loại bỏ mụn đầu đen, mụn trứng cá",
        "Làm sạch sâu lỗ chân lông",
        "Se khít lỗ chân lông, làm dịu và cân bằng da"
      ]
    },
    {
      "id": "tai-sao-chon",
      "heading": "Tại Sao Chọn Her Skinlab?",
      "bullets": [
        "Đội ngũ chuyên gia kinh nghiệm, trang thiết bị hiện đại",
        "Quy trình chuẩn y khoa, sản phẩm an toàn và hiệu quả",
        "Chăm sóc khách hàng chu đáo, theo dõi sau liệu trình"
      ]
    }
  ],
  "faq": [],
  "cta": {
    "phone": "tel:0949774973",
    "link": "lien-he.html",
    "label": "Đặt lịch ngay"
  }
}


