{
  "id": "peel-da-chuyen-sau-sac-to",
  "slug": "peel-da-chuyen-sau-sac-to",
  "categoryId": "dieu-tri-da",
  "title": "PEEL DA CHUYÊN SÂU SẮC TỐ",
  "subtitle": "Giải Pháp Hoàn Hảo Cho Làn Da Sáng Mịn",
  "price": "Giá liên hệ",
  "duration": "90 - 120 phút",
  "hero": {
    "image": "assets/images/services/chemical-peeling.jpg",
    "alt": "Peel da chuyên sâu sắc tố",
    "caption": "Peel da chuyên sâu sắc tố tại Her Skinlab"
  },
  "toc": [
    { "id": "gioi-thieu", "label": "Peel Da Chuyên Sâu Sắc Tố" },
    {
      "id": "loi-ich",
      "label": "Lợi Ích Của Peel Da Chuyên Sâu",
      "children": [
        { "id": "y1", "label": "1. Loại bỏ sắc tố sạm nám" },
        { "id": "y2", "label": "2. Tái tạo làn da mới" },
        { "id": "y3", "label": "3. Cải thiện kết cấu da" },
        { "id": "y4", "label": "4. Tăng cường hấp thụ dưỡng chất" }
      ]
    },
    {
      "id": "quy-trinh",
      "label": "Quy Trình Peel Da Chuyên Sâu",
      "children": [
        { "id": "b1", "label": "1. Thăm Khám và Tư Vấn" },
        { "id": "b2", "label": "2. Chuẩn Bị Da" },
        { "id": "b3", "label": "3. Thực Hiện Peel Da" },
        { "id": "b4", "label": "4. Chăm Sóc Sau Peel" }
      ]
    },
    { "id": "tai-sao-chon", "label": "Tại Sao Chọn Her Skinlab?" },
    { "id": "faq", "label": "Câu Hỏi Thường Gặp" }
  ],
  "sections": [
    {
      "id": "gioi-thieu",
      "heading": "Peel Da Chuyên Sâu Sắc Tố Tại Her Skinlab",
      "content": "Bạn đang lo lắng về làn da không đều màu, sạm nám và thiếu sức sống? Peel da chuyên sâu sắc tố là giải pháp tối ưu giúp lấy lại làn da trắng sáng, mịn màng.",
      "image": "upload/filemanager/images/PEEL%20DA%20CHUY%C3%8AN%20S%C3%82U%20S%E1%BA%AEC%20T%E1%BB%90/1.webp"
    },
    {
      "id": "loi-ich",
      "heading": "Lợi Ích Của Peel Da Chuyên Sâu",
      "bullets": [
        "Làm mờ sắc tố sạm nám, tàn nhang, đốm nâu",
        "Kích thích sản sinh collagen, cải thiện độ đàn hồi",
        "Cải thiện kết cấu da, se khít lỗ chân lông",
        "Tăng cường hấp thụ dưỡng chất"
      ],
      "image": "upload/filemanager/images/PEEL%20DA%20CHUY%C3%8AN%20S%C3%82U%20S%E1%BA%AEC%20T%E1%BB%90/4.webp"
    },
    {
      "id": "quy-trinh",
      "heading": "Quy Trình Peel Da Chuyên Sâu",
      "steps": [
        "Thăm khám và tư vấn liệu trình",
        "Làm sạch dịu nhẹ, chuẩn bị da",
        "Thực hiện peel theo vùng cần điều trị",
        "Hướng dẫn chăm sóc sau peel, phục hồi đúng cách"
      ],
      "image": "upload/filemanager/images/PEEL%20DA%20CHUY%C3%8AN%20S%C3%82U%20S%E1%BA%AEC%20T%E1%BB%90/5.webp"
    },
    {
      "id": "tai-sao-chon",
      "heading": "Tại Sao Chọn Her Skinlab?",
      "bullets": [
        "Đội ngũ chuyên gia kinh nghiệm",
        "Sản phẩm cao cấp, nguồn gốc rõ ràng",
        "Dịch vụ chăm sóc khách hàng chuyên nghiệp"
      ]
    }
  ],
  "faq": [
    { "q": "Peel da có đau không?", "a": "Có thể hơi châm chích hoặc nóng nhẹ và sẽ nhanh chóng qua." },
    { "q": "Thời gian phục hồi bao lâu?", "a": "3-7 ngày tùy loại peel và cơ địa." },
    { "q": "Kết quả kéo dài bao lâu?", "a": "Từ vài tháng đến một năm, nên chăm sóc đúng cách và theo liệu trình." }
  ],
  "cta": {
    "phone": "tel:0949774973",
    "link": "lien-he.html",
    "label": "Đặt lịch ngay"
  }
}


